{
  "acceptance": [
    "A real, non-bypassed child dispatch completes through mlgo-v2-dispatch run-job."
  ],
  "big_task_id": "PROOF",
  "completion_boundary": "N/A - disposable Slice 4 evidence run.",
  "constraints": [
    "Disposable fixture only."
  ],
  "delegation_envelope": {
    "allowed_routes": [
      "claude_subscription_child_direct"
    ],
    "gateway_allowed": false,
    "max_parallel_writers": 1,
    "max_phases": 1,
    "maximum_tier": 5,
    "protected_supervisor_pool_use_allowed": false,
    "supervisor_approval_triggers": []
  },
  "in_scope": [
    "."
  ],
  "out_of_scope": [
    "production deployment"
  ],
  "outcome": "Prove the corrected child-provider transport is reached via canonical dispatch.run_job.",
  "review_policy": {
    "critical_requires_cross_provider": false,
    "default_class": "routine_independent"
  },
  "risk_class": "LOW",
  "run_id": "canonical-proof-claude",
  "schema_version": "2.0"
}
